[
  {
    "schemaVersion": "1.0.0",
    "id": "pref.detailedbsod",
    "origin": "WPFToggleDetailedBSoD",
    "name": "BSoD Verbose Mode",
    "description": "Gives more information when you blue screen.",
    "category": "ui",
    "subcategory": "Customize Preferences",
    "risk": "Low",
    "impacts": [
      "ui"
    ],
    "windows": {
      "minBuild": 19041
    },
    "requiresReboot": true,
    "requiresExplorerRestart": false,
    "detect": {
      "type": "Registry",
      "hive": "HKLM",
      "key": "SYSTEM\\CurrentControlSet\\Control\\CrashControl",
      "valueName": "DisplayParameters",
      "matchType": "Equals",
      "expectedValue": 1
    },
    "apply": [
      {
        "type": "Registry",
        "hive": "HKLM",
        "key": "SYSTEM\\CurrentControlSet\\Control\\CrashControl",
        "operation": "Set",
        "valueName": "DisplayParameters",
        "valueKind": "DWord",
        "data": 1
      },
      {
        "type": "Registry",
        "hive": "HKLM",
        "key": "SYSTEM\\CurrentControlSet\\Control\\CrashControl",
        "operation": "Set",
        "valueName": "DisableEmoticon",
        "valueKind": "DWord",
        "data": 1
      }
    ],
    "undo": [
      {
        "type": "Registry",
        "hive": "HKLM",
        "key": "SYSTEM\\CurrentControlSet\\Control\\CrashControl",
        "operation": "Set",
        "valueName": "DisplayParameters",
        "valueKind": "DWord",
        "data": 0
      },
      {
        "type": "Registry",
        "hive": "HKLM",
        "key": "SYSTEM\\CurrentControlSet\\Control\\CrashControl",
        "operation": "Set",
        "valueName": "DisableEmoticon",
        "valueKind": "DWord",
        "data": 0
      }
    ],
    "source": "https://winutil.christitus.com/code-reference/tweaks/customize-preferences/detailedbsod",
    "verifiedOnBuild": "26100",
    "evidence": "situational",
    "whatItDoes": "Configures Windows crash handler to display detailed technical stop codes and driver names.",
    "sideEffects": "Shows full technical diagnostic details instead of the friendly blue-screen emoticon.",
    "sources": [
      "https://learn.microsoft.com/en-us/windows-hardware/drivers/debugger/bug-check-code-reference2"
    ],
    "needsReview": false,
    "tags": [
      "ui"
    ],
    "presetRole": "fix"
  },
  {
    "schemaVersion": "1.0.0",
    "id": "pref.batterypercentage",
    "origin": "WPFToggleBatteryPercentage",
    "name": "System Tray Battery Percentage",
    "description": "Shows numeric battery percentage next to the battery icon in the system tray.",
    "category": "ui",
    "subcategory": "Customize Preferences",
    "risk": "Safe",
    "impacts": [
      "ui"
    ],
    "windows": {
      "minBuild": 26100
    },
    "requiresReboot": false,
    "requiresExplorerRestart": true,
    "detect": {
      "type": "Registry",
      "hive": "HKCU",
      "key": "Software\\Microsoft\\Windows\\CurrentVersion\\Explorer\\Advanced",
      "valueName": "IsBatteryPercentageEnabled",
      "matchType": "Equals",
      "expectedValue": 1
    },
    "apply": [
      {
        "type": "Registry",
        "hive": "HKCU",
        "key": "Software\\Microsoft\\Windows\\CurrentVersion\\Explorer\\Advanced",
        "operation": "Set",
        "valueName": "IsBatteryPercentageEnabled",
        "valueKind": "DWord",
        "data": 1
      }
    ],
    "undo": [
      {
        "type": "Registry",
        "hive": "HKCU",
        "key": "Software\\Microsoft\\Windows\\CurrentVersion\\Explorer\\Advanced",
        "operation": "DeleteValue",
        "valueName": "IsBatteryPercentageEnabled"
      }
    ],
    "source": "https://winutil.christitus.com/code-reference/tweaks/customize-preferences/batterypercentage",
    "verifiedOnBuild": "26100",
    "evidence": "ui-equivalent",
    "whatItDoes": "Enables battery remaining percentage indicator on the Windows taskbar.",
    "sideEffects": "Requires a laptop or battery device; not applicable to desktop systems.",
    "sources": [
      "https://learn.microsoft.com/en-us/windows/apps/design/controls/progress-bar"
    ],
    "needsReview": false,
    "uiEquivalentLocation": "Settings > System > Power & battery > Battery percentage",
    "tags": [
      "ui"
    ],
    "presetRole": "preference",
    "effectNote": "Needs Windows 11 24H2 build 26100.7019 or 25H2 build 26200.7019 or newer, and a device with a battery."
  },
  {
    "schemaVersion": "1.0.0",
    "id": "pref.darkmode",
    "origin": "WPFToggleDarkMode",
    "name": "Dark Theme for Windows",
    "description": "Dark Mode for the system and applications.",
    "category": "ui",
    "subcategory": "Customize Preferences",
    "risk": "Safe",
    "impacts": [
      "ui"
    ],
    "windows": {
      "minBuild": 19041
    },
    "requiresReboot": false,
    "requiresExplorerRestart": false,
    "detect": {
      "type": "Registry",
      "hive": "HKCU",
      "key": "SOFTWARE\\Microsoft\\Windows\\CurrentVersion\\Themes\\Personalize",
      "valueName": "AppsUseLightTheme",
      "matchType": "Equals",
      "expectedValue": 0
    },
    "apply": [
      {
        "type": "Registry",
        "hive": "HKCU",
        "key": "SOFTWARE\\Microsoft\\Windows\\CurrentVersion\\Themes\\Personalize",
        "operation": "Set",
        "valueName": "AppsUseLightTheme",
        "valueKind": "DWord",
        "data": 0
      },
      {
        "type": "Registry",
        "hive": "HKCU",
        "key": "SOFTWARE\\Microsoft\\Windows\\CurrentVersion\\Themes\\Personalize",
        "operation": "Set",
        "valueName": "SystemUsesLightTheme",
        "valueKind": "DWord",
        "data": 0
      }
    ],
    "undo": [
      {
        "type": "Registry",
        "hive": "HKCU",
        "key": "SOFTWARE\\Microsoft\\Windows\\CurrentVersion\\Themes\\Personalize",
        "operation": "Set",
        "valueName": "AppsUseLightTheme",
        "valueKind": "DWord",
        "data": 1
      },
      {
        "type": "Registry",
        "hive": "HKCU",
        "key": "SOFTWARE\\Microsoft\\Windows\\CurrentVersion\\Themes\\Personalize",
        "operation": "Set",
        "valueName": "SystemUsesLightTheme",
        "valueKind": "DWord",
        "data": 1
      }
    ],
    "source": "https://winutil.christitus.com/code-reference/tweaks/customize-preferences/darkmode",
    "verifiedOnBuild": "26100",
    "evidence": "ui-equivalent",
    "whatItDoes": "Enables system-wide dark theme for Windows shell and supported desktop apps.",
    "sideEffects": "None known.",
    "sources": [
      "https://learn.microsoft.com/en-us/windows/apps/design/style/color"
    ],
    "needsReview": false,
    "uiEquivalentLocation": "Settings › Personalization › Colors › Choose your mode",
    "tags": [
      "ui"
    ],
    "presetRole": "preference"
  },
  {
    "schemaVersion": "1.0.0",
    "id": "pref.verboselogon",
    "origin": "WPFToggleVerboseLogon",
    "name": "Logon Verbose Mode",
    "description": "Show detailed messages during startup/shutdown.",
    "category": "ui",
    "subcategory": "Customize Preferences",
    "risk": "Low",
    "impacts": [
      "ui"
    ],
    "windows": {
      "minBuild": 19041
    },
    "requiresReboot": false,
    "requiresExplorerRestart": false,
    "detect": {
      "type": "Registry",
      "hive": "HKLM",
      "key": "SOFTWARE\\Microsoft\\Windows\\CurrentVersion\\Policies\\System",
      "valueName": "VerboseStatus",
      "matchType": "Equals",
      "expectedValue": 1
    },
    "apply": [
      {
        "type": "Registry",
        "hive": "HKLM",
        "key": "SOFTWARE\\Microsoft\\Windows\\CurrentVersion\\Policies\\System",
        "operation": "Set",
        "valueName": "VerboseStatus",
        "valueKind": "DWord",
        "data": 1
      }
    ],
    "undo": [
      {
        "type": "Registry",
        "hive": "HKLM",
        "key": "SOFTWARE\\Microsoft\\Windows\\CurrentVersion\\Policies\\System",
        "operation": "Set",
        "valueName": "VerboseStatus",
        "valueKind": "DWord",
        "data": 0
      }
    ],
    "source": "https://winutil.christitus.com/code-reference/tweaks/customize-preferences/verboselogon",
    "verifiedOnBuild": "26100",
    "evidence": "situational",
    "whatItDoes": "Enables verbose status messages during Windows sign-in, startup, and shutdown.",
    "sideEffects": "Shows detailed service initialization steps on the logon screen, slightly changing startup visual presentation.",
    "sources": [
      "https://learn.microsoft.com/en-us/troubleshoot/windows-server/user-profiles-and-logon/enable-verbose-startup-shutdown-logon-logoff-status-messages"
    ],
    "needsReview": false,
    "tags": [
      "ui"
    ],
    "presetRole": "fix"
  },
  {
    "schemaVersion": "1.0.0",
    "id": "pref.newoutlook",
    "origin": "WPFToggleNewOutlook",
    "name": "Microsoft Outlook - Use New Version",
    "description": "Switches classic Outlook to the new Outlook and shows the toggle for it. Undo switches back.",
    "category": "ui",
    "subcategory": "Customize Preferences",
    "risk": "Safe",
    "impacts": [
      "ui"
    ],
    "windows": {
      "minBuild": 19041
    },
    "requiresReboot": false,
    "requiresExplorerRestart": false,
    "detect": {
      "type": "Registry",
      "hive": "HKCU",
      "key": "SOFTWARE\\Microsoft\\Office\\16.0\\Outlook\\Preferences",
      "valueName": "UseNewOutlook",
      "matchType": "Equals",
      "expectedValue": 1
    },
    "apply": [
      {
        "type": "Registry",
        "hive": "HKCU",
        "key": "SOFTWARE\\Microsoft\\Office\\16.0\\Outlook\\Preferences",
        "operation": "Set",
        "valueName": "UseNewOutlook",
        "valueKind": "DWord",
        "data": 1
      },
      {
        "type": "Registry",
        "hive": "HKCU",
        "key": "Software\\Microsoft\\Office\\16.0\\Outlook\\Options\\General",
        "operation": "Set",
        "valueName": "HideNewOutlookToggle",
        "valueKind": "DWord",
        "data": 0
      },